{
  "$schema": "http://json-schema.org/draft-07/schema#",
  "$id": "https://justicex.ai/schemas/page-content-model.schema.json",
  "title": "JusticeX Page Content Model (v2 — reconciled to the 44-surface hierarchy + Tailored Value Propositions v2, 2026-07-16)",
  "description": "One record = one surface. The SINGLE SOURCE OF TRUTH for a surface's message. Claude authors it, then derives the Gemini Notebook / Higgsfield / avatar briefs from it, and the site renders it into the LOCKED Families skeleton. RECONCILED: uses the canonical three-door taxonomy (Markets · Channels · Solutions) with three-tier context inheritance, the canonical value-prop structure (Lead → Substance → Tier-2 frame → Master promise → The ask), per-surface coverage, and concentrated disclosure. Tailoring lives only in the (tailored) fields; the (locked) block is inherited.",
  "type": "object",
  "required": ["surface_id", "url_path", "taxonomy", "coverage", "locked", "copy", "disclosure_block", "media", "governance"],
  "additionalProperties": false,
  "properties": {

    "surface_id": { "type": "string", "description": "Stable slug, e.g. 'channels-mediators'." },
    "url_path": { "type": "string", "description": "Clean, attributable URL, e.g. '/channels/mediators'." },
    "value_prop_ref": { "type": "string", "description": "Section in 'Tailored Value Propositions v2', e.g. '2.4.1 Channels · Mediators'." },
    "tier": { "type": "string", "enum": ["1 master", "2 hub", "3 leaf", "stage-guide", "utility"], "description": "Position in the 44-surface hierarchy." },
    "effort_tier": { "type": "string", "enum": ["1:many", "1:few", "1:1"], "description": "Personalization effort tier." },
    "coverage": { "type": "array", "minItems": 1, "items": { "type": "string", "enum": ["Live", "Gated", "Roadmap", "Specified"] }, "description": "Honest-coverage status (array, so compound canon like Live/Roadmap is representable); drives coverage tags + disclosure. Utility pages = [\"Live\"]." },
    "fan_out_wave": { "type": "string", "enum": ["hubs-first", "wave-1", "wave-2", "wave-3", "wave-4", "n/a"], "description": "Per the matrix fan-out sequence." },

    "taxonomy": {
      "type": "object",
      "description": "The canonical three-door taxonomy + three-tier context. This replaces the loose 'axes'.",
      "required": ["door", "context_tier2"],
      "additionalProperties": false,
      "properties": {
        "door": { "type": "string", "enum": ["Markets", "Channels", "Solutions", "Master", "Technology"], "description": "Which of the three doors (or Master/Technology top-level) this surface sits behind." },
        "context_tier2": { "type": "string", "enum": ["Markets", "Channels", "Master"], "description": "The middle-layer context block this surface INHERITS (§3.1 Markets / §3.2 Channels / direct-to-master)." },
        "market": { "type": "string", "enum": ["Families", "Businesses (Workplaces & employers)", "Communities & HOAs", "Campuses & schools", "Government", "n/a"], "description": "For Markets-door surfaces." },
        "channel": { "type": "string", "enum": ["Mediators", "Attorneys", "Finance & Tax Professionals", "Technology Partners", "Sponsoring Organizations", "n/a"], "description": "The five canonical channels (Value-Props §3.2). 'n/a' for Markets/Master surfaces (no channel door)." },
        "solution": {
          "type": "object",
          "description": "Matter type × jurisdiction (Solutions door / any surface's covered matter).",
          "properties": {
            "litigation_type": { "type": "string", "example": "Divorce & custody" },
            "jurisdiction": { "type": "string", "example": "New York" }
          }
        },
        "org_lifecycle": { "type": "boolean", "description": "TRUE for organization surfaces (Businesses, Sponsoring Orgs, Government) — carry Prevent → Resolve → Improve as first-class substance (§3.3)." },
        "account": { "type": "object", "properties": { "name": { "type": "string" }, "logo_asset": { "type": "string" } }, "description": "1:1 only." },
        "presenter": { "type": "object", "properties": { "name": { "type": "string" }, "initials": { "type": "string" }, "title": { "type": "string" } } }
      }
    },

    "locked": {
      "type": "object",
      "description": "INHERITED — never edited per surface. Asserted so the renderer + QA gate can enforce.",
      "additionalProperties": false,
      "required": ["tokens_version", "skeleton_version", "shell", "voice", "posture", "master_promise_source"],
      "properties": {
        "tokens_version": { "type": "string", "const": "tokens.css@v2" },
        "skeleton_version": { "type": "string", "const": "families-skeleton@v1" },
        "shell": { "type": "string", "const": "shared" },
        "voice": { "type": "string", "const": "objective-evidence-led" },
        "posture": { "type": "string", "const": "objective-symmetric-amicable" },
        "master_promise_source": { "type": "string", "const": "Value Props v2 Part 2 — say it once, everywhere" }
      }
    },

    "copy": {
      "type": "object",
      "description": "(tailored) Claude-generated to the CANONICAL value-prop structure. Keep the sell pure; concentrate disclosure (§1.3).",
      "required": ["lead", "substance", "master_promise", "the_ask"],
      "additionalProperties": false,
      "properties": {
        "hero_eyebrow": { "type": "string" },
        "hero_title": { "type": "string", "description": "The surface's headline (its Lead, said as a title)." },
        "lead": { "type": "string", "description": "Tier 3 — the surface's own audience, pain, and value (the entry point)." },
        "substance": { "type": "string", "description": "The verifiable value spine; for org surfaces, the Prevent→Resolve→Improve lifecycle." },
        "tier2_frame": { "type": "string", "description": "The inherited Markets or Channels context line. OMIT for Master/Home/Solutions/Technology (they carry the master promise directly)." },
        "master_promise": { "type": "string", "description": "Tier 1 — the close: both sides see the same honest picture and resolve on the facts. Truth · Fairness · Efficiency." },
        "the_ask": { "type": "string", "description": "The single CTA for this surface (e.g. 'Become a founding partner')." },
        "cta_href": { "type": "string" },
        "proof_points": { "type": "array", "items": { "type": "string" }, "description": "Verifiable proofs; mark any unverified figure [verify]." },
        "coverage_tags": { "type": "array", "items": { "type": "string" }, "description": "Per §1.3 place 3 — tag any capability not live today (Live / Gated / Roadmap / Specified)." },
        "example_matter": {
          "type": "object",
          "description": "SYNTHETIC worked example. Never real data.",
          "properties": {
            "matter_ref": { "type": "string", "enum": ["Whitfield", "Rivera", "Okafor", "Delgado"] },
            "case_name": { "type": "string" },
            "body": { "type": "string" },
            "rows": { "type": "array", "items": { "type": "object", "properties": { "label": { "type": "string" }, "value": { "type": "string" } } } }
          }
        }
      }
    },

    "disclosure_block": {
      "type": "object",
      "description": "The CONCENTRATED legal layer (§1.3 / Part 5) — three defined places only, never sprinkled in the sell.",
      "required": ["standing_line", "keeps_this_honest"],
      "properties": {
        "standing_line": { "type": "string", "const": "AI-assisted overviews · figures illustrative · not legal advice." },
        "keeps_this_honest": { "type": "string", "description": "The per-surface 'How JusticeX keeps this honest' block — objective-comparison/software-not-a-forum, live-vs-roadmap, no-advice/no-prediction/no-settlement." },
        "coverage_statement": { "type": "string", "description": "What is live vs gated vs roadmap for THIS surface." }
      }
    },

    "media": {
      "type": "object",
      "description": "Full four-asset pack on every content surface (Gregg, Jul 16). Briefs DERIVED from copy. video_owner prevents duplicate videos.",
      "required": ["video_owner"],
      "additionalProperties": false,
      "properties": {
        "video_owner": { "type": "string", "enum": ["gemini_notebook", "higgsfield"], "description": "Exactly one owner for this surface's explanatory/produced video. Never both." },

        "gemini_notebook_brief": {
          "type": "object",
          "description": "The explanatory, source-grounded pack. Gemini Notebook (formerly NotebookLM; renamed 2026-07-16, Studio generators unchanged, model Gemini 3.5).",
          "properties": {
            "assets": { "type": "array", "items": { "type": "string", "enum": ["audio", "video", "infographic", "deck"] }, "description": "Full four-asset pack for content surfaces." },
            "subject": { "type": "string" },
            "source_docs": { "type": "array", "items": { "type": "string" }, "description": "Grounding sources (value-props v2, positioning canon, surface copy). Synthetic only." },
            "key_points": { "type": "array", "items": { "type": "string" } },
            "studio_defaults": { "type": "string", "const": "Audio=Brief/Shorter · Video=Brief ~60–90s/Classic+custom palette · Infographic=orientation+Standard · Deck=Presenter ~8 slides PDF+PPTX" },
            "palette_ban": { "type": "string", "const": "reject teal/mint/green/cyan/yellow/gold/magenta/pink/purple; navy+coral only" },
            "disclosure_line": { "type": "string", "const": "AI-assisted overviews · figures illustrative · not legal advice." }
          }
        },

        "higgsfield_brief": {
          "type": "object",
          "description": "The visual & cinematic layer — marketing site only; no user data. Soul ID / style kit locks the look.",
          "properties": {
            "assets": { "type": "array", "items": { "type": "string", "enum": ["hero_image", "section_art", "motion_bg", "b_roll", "animated_process", "brand_video"] } },
            "style_kit_id": { "type": "string", "const": "jx-soulkit@v1" },
            "art_direction": { "type": "string" },
            "palette": { "type": "string", "const": "navy #042C53 + coral #D85A30 on white/light" },
            "negative_constraints": { "type": "string", "const": "no fabricated human faces; no scales/gavel/courtroom; no stock handshakes; no off-palette" },
            "seed_image": { "type": "string" }
          }
        },

        "avatar": {
          "type": "object",
          "description": "Real, CONSENTED likeness only (Synthesia/HeyGen), or voice-only. Never Higgsfield-fabricated, never a cartoon.",
          "properties": {
            "enabled": { "type": "boolean" },
            "modality": { "type": "string", "enum": ["voice_only", "real_consented_avatar"] },
            "tool": { "type": "string", "enum": ["Synthesia", "HeyGen", "none"] },
            "presenter_identity": { "type": "string" },
            "consent_ref": { "type": "string" },
            "script_ref": { "type": "string" },
            "disclosure": { "type": "string", "const": "AI-assisted presenter — shown at first exposure (EU AI Act Art. 50)." }
          },
          "if": { "properties": { "modality": { "const": "real_consented_avatar" } }, "required": ["modality"] },
          "then": { "required": ["tool", "presenter_identity", "consent_ref"], "properties": { "tool": { "enum": ["Synthesia", "HeyGen"] } } }
        }
      }
    },

    "governance": {
      "type": "object",
      "required": ["status"],
      "additionalProperties": false,
      "properties": {
        "status": { "type": "string", "enum": ["draft", "generating", "qa", "approved", "published"] },
        "design_lint": { "type": "string", "enum": ["pending", "pass", "fail"] },
        "brand_legal_qa": { "type": "string", "enum": ["pending", "pass", "fail"] },
        "fable_review": { "type": "string", "enum": ["n/a", "pending", "pass", "fail"] },
        "counsel_gate": { "type": "string", "enum": ["n/a", "pending", "cleared"], "description": "Required for Gated/Roadmap surfaces before public wiring." },
        "propagate_dod": { "type": "string", "enum": ["pending", "done"] },
        "checkpoint_refs": { "type": "array", "items": { "type": "string" } },
        "notes": { "type": "string" }
      }
    }
  }
}
